{
  "specVersion": 1,
  "id": "core.cross",
  "name": "Crossroads",
  "pack": "core",
  "category": "connector",
  "cost": 2,
  "connectors": ["north", "east", "south", "west"],
  "shell": {
    "materials": { "wall": "wall", "floor": "floor", "ceiling": "ceiling", "trim": "trim" },
    "doorFrame": "plain",
    "interior": { "width": 4, "height": 4 }
  },
  "intendedPaths": [
    { "from": "south", "to": "north", "points": [[0, 0, -4], [0, 0, 4]] },
    { "from": "west", "to": "east", "points": [[-4, 0, 0], [4, 0, 0]] }
  ],
  "skins": ["*"],
  "notes": "Open on all four sides. Rotation does not change it, which makes it the one cube the Nightmare can place without thinking."
}
